,alcoholic,cocktail_name,glass,ingredients,ingredients_and_quantities,instructions,cocktail_picture,popular_month_name,visitors,popular_month_no,popular_season_name,alcohol_type_includes,liqueurs_includes
302,Alcoholic,Pure Passion,Whiskey sour glass,"Mint, Peach Bitters, Passion Fruit Syrup, Lime Juice, Passoa, Rum, ","Mint - Garnish with, Peach Bitters - Dash, Passion fruit syrup - 15 ml, Lime Juice - 30 ml, Passoa - 20 ml, Rum - 40 ml,",Mix up all ingredients with a cocktail stirrer and serve with crushed ice with mint and edible flour if available.,https://www.thecocktaildb.com/images/media/drink/4tymma1604179273.jpg,,,,,['rum'],
303,Alcoholic,Popped cherry,Highball glass,"Orange Juice, Cranberry Juice, Cherry Liqueur, Vodka, ","Orange juice - 4 oz , Cranberry juice - 4 oz , Cherry liqueur - 2 oz , Vodka - 2 oz ,",Served over ice in a tall glass with a popped cherry (can add more popped cherries if in the mood)!,https://www.simplyrecipes.com/thmb/-UD_Z-ehi2VKhTDKJPwp5eeZ7lE=/1500x0/filters:no_upscale():max_bytes(150000):strip_icc()/Simply-Recipes-Cherry-Pop-Cocktail-LEAD-5_RECIRC-ad3b7f23c4d84bebabafa63370626d4d.jpg,,,,,['vodka'],
304,Alcoholic,Poppy Cocktail,Cocktail glass,"Creme De Cacao, Gin, ","Creme de Cacao - 3/4 oz white , Gin - 1 1/2 oz ,","Shake ingredients with ice, strain into a cocktail glass, and serve.",https://www.goodcocktails.com/images/drinks/white-spider/white-spider-380.webp,,,,,['gin'],
305,Alcoholic,Port Wine Flip,Whiskey sour glass,"Nutmeg, Egg, Powdered Sugar, Light Cream, Port, ","Nutmeg, Egg - 1 whole , Powdered sugar - 1 tsp , Light cream - 2 tsp , Port - 1 1/2 oz ,",Shake all ingredients (except nutmeg) with ice and strain into a whiskey sour glass. Sprinkle nutmeg on top and serve.,"https://ik.imagekit.io/bhug69xts/tr:h-1200,w-1200/port-flip.png",,,,,['wine'],
306,Alcoholic,Planter's Punch,Collins glass,"Pineapple Juice, Orange Juice, Orgeat Syrup, Dark Rum, ","Pineapple juice - 1 part , Orange juice - 2 parts , Orgeat syrup - 1/2 part , Dark rum - 1 part ,","Pour all ingredients, except the bitters, into shaker filled with ice. Shake well. Pour into large glass, filled with ice. Add Angostura bitters, ""on top"". Garnish with cocktail cherry and pineapple.",http://www.thecocktaildb.com/images/media/drink/yvos231504351384.jpg,,,,,['rum'],
307,Alcoholic,Pineapple Paloma,Collins glass,"Pepper, Lime, Pineapple Juice, Fresh Lime Juice, Grapefruit Juice, Tequila, ","Pepper - Rimmed, Lime - Garnish with, Pineapple Juice - 8 oz, Fresh Lime Juice - 1 oz, Grapefruit Juice - 4 oz, Tequila - 4 oz,","Rub the rim of each glass with lime slice and dip into salt.

Add ice, tequila, grapefruit juice, lime juice and top with pineapple soda.

Give it a quick stir.

Garnish with fresh pineapple or lime.",https://www.missinthekitchen.com/wp-content/uploads/2019/03/Pineapple-Paloma-Cocktail-Recipe-Photo.jpg,,,,,['tequila'],
308,Alcoholic,Pornstar Martini,Cocktail glass,"Prosecco, Lime, Passion Fruit Juice, Passoa, Vodka, ","Prosecco - 1 shot, Lime - 1 cl, Passion fruit juice - 1 cl, Passoa - 3 cl, Vodka - 3 cl,",Straight: Pour all ingredients into mixing glass with ice cubes. Shake well. Strain in chilled martini cocktail glass. Cut passion fruit in half and use as garnish. Pour prosecco into a chilled shot glass and serve alongside the martini.,https://www.thecocktaildb.com/images/media/drink/xjhjdf1630406071.jpg,,,,,"['vodka', 'wine']",
309,Alcoholic,Planters Punch,Highball glass,"Angostura Bitters, Sugar Syrup, Grenadine, Pineapple Juice, Orange Juice, Dark Rum, ","Angostura Bitters - 4 drops, Sugar Syrup - 1 cl, Grenadine - 1 cl, Pineapple Juice - 3.5 cl, Orange Juice - 3 cl, Dark Rum - 4.5 cL,",Squeeze an orange and strain the juice. Put all the ingredients in a shaker filled with ice and shake for at least 12 seconds. Strain into a highball glass and decorate with a pineapple wedge or fruit of your choice.,https://www.liquor.com/thmb/5YCaNXWLJcGjhpQdZJKdBYs5NS0=/1500x0/filters:no_upscale():max_bytes(150000):strip_icc()/__opt__aboutcom__coeus__resources__content_migration__liquor__2018__02__14093314__planters-punch-720x720-recipe-b588afaf107743f88f79db8f7c386e83.jpg,,,,,['rum'],
310,Alcoholic,Port And Starboard,Pousse cafe glass,"Green Creme De Menthe, Grenadine, ","Green Creme de Menthe - 1/2 oz , Grenadine - 1 tblsp ,","Pour carefully into a pousse-cafe glass, so that creme de menthe floats on grenadine. Serve without mixing.",https://cdn.diffords.com/contrib/stock-images/2017/1/32/2017f47c724aec150ab53ce883a600dc4b4d.jpg,,,,,,
311,Alcoholic,Port Wine Cocktail,Cocktail glass,"Brandy, Port, ","Brandy - 1/2 tsp , Port - 2 1/2 oz ,","Stir ingredients with ice, strain into a cocktail glass, and serve.",http://www.thecocktaildb.com/images/media/drink/qruprq1441553976.jpg,,,,,"['brandy', 'wine']",
312,Non alcoholic,Pysch Vitamin Light,Collins Glass,"Ice, Pineapple Juice, Apple Juice, Orange Juice, ","Ice, Pineapple juice - 1 part , Apple juice - 1 part , Orange juice - 1 part ,",Shake with ice.,http://www.thecocktaildb.com/images/media/drink/xsqsxw1441553580.jpg,,,,,,
313,Alcoholic,Pink Panty Pulldowns,Collins Glass,"Vodka, Pink Lemonade, Sprite, ","Vodka - 2 cups , Pink lemonade - 2 cups , Sprite - 1 L ,",Shake well,http://www.thecocktaildb.com/images/media/drink/squsuy1468926657.jpg,,,,,['vodka'],
314,Alcoholic,Passion Fruit Martini,Cocktail glass,"Passion Fruit Juice, Sugar Syrup, Vodka, ","Passion fruit juice - Full Glass, Sugar Syrup - 1/2 shot, Vodka - 1 shot,",Pour all ingredients into a glass and stir. Garnish with half a passion fruit piece.,https://www.greygoose.com/binaries/content/gallery/greygoose/cocktails/la-vanille/passionfruit-martini/portrait.jpg,,,,,['vodka'],
315,Non alcoholic,Pineapple Gingerale Smoothie,Highball Glass,"Pineapple, Ginger, ","Pineapple - 1/2 , Ginger - 1/4 inch ,",Throw everything into a blender and liquify.,http://www.thecocktaildb.com/images/media/drink/eg9i1d1487603469.jpg,,,,,['gin'],
316,Alcoholic,Quentin,Cocktail glass,"Nutmeg, Light Cream, Kahlua, Dark Rum, ","Nutmeg - 1/8 tsp grated , Light cream - 1 oz , Kahlua - 1/2 oz , Dark rum - 1 1/2 oz ,","In a shaker half-filled with ice cubes, combine the rum, Kahlua, and cream. Shake well. Strain into a cocktail glass and garnish with the nutmeg.",http://www.thecocktaildb.com/images/media/drink/spxtqp1478963398.jpg,,,,,['rum'],['liqueurs']
317,Alcoholic,Queen Bee,Cocktail glass,"Sherry, Lime Vodka, Coffee Brandy, ","Sherry - 1/2 oz cream , Lime vodka - 1 1/2 oz , Coffee brandy - 1 oz ,","Shake all ingredients with ice, strain into a cocktail glass, and serve.",https://media.diageocms.com/eyJrZXkiOiJtZWRpYS96cGRoa29vby9yZWNpcGVpbWFnZV9hbGNvaG9sZnJlZXF1ZWVuYmVlLmpwZyIsImVkaXRzIjp7InJlc2l6ZSI6eyJoZWlnaHQiOjYxMCwid2lkdGgiOjYxMH19fQ==,,,,,"['brandy', 'vodka', 'wine']",
318,Alcoholic,Quick F**K,Shot glass,"Baileys Irish Cream, Midori Melon Liqueur, Kahlua, ","Baileys irish cream - 1 part , Midori melon liqueur - 1 part , Kahlua - 1 part ,","In a shot glass add 1/3 Kahlua first. Then 1/3 Miduri, topping it off with a 1/3 bailey's irish cream",http://www.thecocktaildb.com/images/media/drink/wvtwpp1478963454.jpg,,,,,,['liqueurs']
319,Alcoholic,Quick-sand,Highball glass,"Orange Juice, Black Sambuca, ","Orange juice - Add 250 ml , Black Sambuca - 25 ml ,","Simply add the orange juice, quite a quick pour in order to mix the sambucca with the orange juice. The juice MUST have fruit pulp!",http://www.thecocktaildb.com/images/media/drink/vprxqv1478963533.jpg,,,,,,['liqueurs']
320,Alcoholic,Queen Charlotte,Collins glass,"Lemon-Lime Soda, Grenadine, Red Wine, ","Lemon-lime soda, Grenadine - 1 oz , Red wine - 2 oz ,","Pour red wine and grenadine into a collins glass over ice cubes. Fill with lemon-lime soda, stir, and serve.",https://www.theshakencocktail.com/wp-content/uploads/2022/11/iStock-1148937381.jpg,,,,,['wine'],
321,Alcoholic,Queen Elizabeth,Cocktail glass,"Benedictine, Gin, Dry Vermouth, ","Benedictine - 1 1/2 tsp , Gin - 1 1/2 oz , Dry Vermouth - 1/2 oz ,","Stir all ingredients with ice, strain into a cocktail glass, and serve.",https://cdn.diffords.com/contrib/stock-images/2022/09/631a2fc0371a0.jpg,,,,,"['gin', 'wine']",['liqueurs']
322,Alcoholic,Quaker's Cocktail,Cocktail glass,"Raspberry Syrup, Lemon, Brandy, Light Rum, ","Raspberry syrup - 2 tsp , Lemon - Juice of 1/4 , Brandy - 3/4 oz , Light rum - 3/4 oz ,","Shake all ingredients with ice, strain into a cocktail glass, and serve.",http://www.thecocktaildb.com/images/media/drink/yrqppx1478962314.jpg,,,,,"['brandy', 'rum']",
323,Alcoholic,Quarter Deck Cocktail,Cocktail glass,"Lime, Sherry, Light Rum, ","Lime - Juice of 1/2 , Sherry - 1/3 oz cream , Light rum - 1 1/2 ,","Stir all ingredients with ice, strain into a cocktail glass, and serve.",http://www.thecocktaildb.com/images/media/drink/qrwvps1478963017.jpg,,,,,"['rum', 'wine']",
324,Alcoholic,Rose,Cocktail glass,"Powdered Sugar, Grenadine, Lemon Juice, Apricot Brandy, Gin, Dry Vermouth, ","Powdered sugar, Grenadine - 1 tsp , Lemon juice - 1/2 tsp , Apricot brandy - 1/2 oz , Gin - 1 oz , Dry Vermouth - 1/2 oz ,","Shake together in a cocktail shaker, then strain into chilled glass. Garnish and serve.",http://www.thecocktaildb.com/images/media/drink/8kxbvq1504371462.jpg,,,,,"['brandy', 'gin', 'wine']",['liqueurs']
325,Alcoholic,Radler,Highball glass,"7-Up, Beer,","7-Up - 12 oz , Beer - 12 oz ,","Pour beer into large mug, slowly add the 7-up (or Sprite).",https://www.craftbeering.com/wp-content/uploads/2017/06/Radler-with-Rosemary-and-Lemon-Garnish.jpg,,,,,['beer'],
326,Alcoholic,Rum Sour,Whiskey sour glass,"Maraschino Cherry, Orange, Sugar, Lemon Juice, Light Rum, ","Maraschino cherry - 1 , Orange - 1 , Sugar - 1/2 tsp superfine , Lemon juice - 1 oz , Light rum - 2 oz ,","In a shaker half-filled with ice cubes, combine the rum, lemon juice, and sugar. Shake well. Strain into a sour glass and garnish with the orange slice and the cherry.",http://www.thecocktaildb.com/images/media/drink/bylfi21504886323.jpg,,,,,['rum'],['liqueurs']
327,Alcoholic,Rum Punch,Punch bowl,"Ice, Orange Juice, Fruit Punch, Ginger Ale, Rum, ","Ice - crushed , Orange juice - 355 ml frozen , Fruit punch - 355 ml frozen , Ginger ale - large bottle , Rum - mikey bottle ,",Mix all ingredients in a punch bowl and serve.,http://www.thecocktaildb.com/images/media/drink/wyrsxu1441554538.jpg,,,,,"['beer', 'gin', 'rum']",
328,Alcoholic,Rum Toddy,Old-fashioned glass,"Water, Lemon Peel, Powdered Sugar, Rum, ","Water - 2 tsp , Lemon peel - 1 twist of , Powdered sugar - 2 tsp , Rum - 2 oz light or dark ,",Dissolve powdered sugar in water in an old-fashioned glass. Add rum and one ice cube and stir. Add the twist of lemon peel and serve.,http://www.thecocktaildb.com/images/media/drink/athdk71504886286.jpg,,,,,['rum'],
329,Alcoholic,Royal Fizz,Collins glass,"Coca-Cola, Egg, Sweet And Sour, Gin, ","Coca-Cola, Egg - 1 whole , Sweet and sour - 2 oz , Gin - 1 oz ,",Shake all ingredients (except cola) with ice and strain into a chilled collins glass. Fill with cola and serve.,"https://ik.imagekit.io/bhug69xts/tr:h-1200,w-1200/royal-fizz.png",,,,,"['beer', 'gin']",
330,Alcoholic,Rum Cooler,Collins glass,"Lemon, Lemon-Lime Soda, Rum, ","Lemon - 1 , Lemon-lime soda - 4 oz , Rum - 2 oz light or dark ,",Pour the rum and soda into a collins glass almost filled with ice cubes. Stir well and garnish with the lemon wedge.,http://www.thecocktaildb.com/images/media/drink/2hgwsb1504888674.jpg,,,,,['rum'],
331,Alcoholic,Rum Runner,Cocktail glass,"Cranberry Juice, Pineapple Juice, Orange Juice, Blackberry Brandy, Malibu Rum, ","Cranberry juice - 3-4 oz , Pineapple juice - 3-4 oz , Orange juice - 3-4 oz , Blackberry brandy - 1 oz , Malibu rum - 1 1/2 oz ,",Mix all ingredients in glass & add ice.,http://www.thecocktaildb.com/images/media/drink/vqws6t1504888857.jpg,,,,,"['brandy', 'rum']",
332,Alcoholic,Rusty Nail,Old-fashioned glass,"Lemon Peel, Drambuie, Scotch, ","Lemon peel - 1 twist of , Drambuie - 1/2 oz , Scotch - 1 1/2 oz ,",Pour the Scotch and Drambuie into an old-fashioned glass almost filled with ice cubes. Stir well. Garnish with the lemon twist.,http://www.thecocktaildb.com/images/media/drink/yqsvtw1478252982.jpg,,,,,['whiskey'],['liqueurs']
333,Alcoholic,Red Snapper,Old-fashioned glass,"Cranberry Juice, Amaretto, Crown Royal, ","Cranberry juice - 1 shot , Amaretto - 1 shot , Crown Royal - 1 shot ,","One shot each, shake n shoot",http://www.thecocktaildb.com/images/media/drink/7p607y1504735343.jpg,,,,,['whiskey'],['liqueurs']
334,Alcoholic,Royal Bitch,Shot glass,"Crown Royal, Frangelico, ","Crown Royal - 1 part , Frangelico - 1 part ,",Into a shot glass layer the Crown Royal on top of the Frangelico.,http://www.thecocktaildb.com/images/media/drink/qupuyr1441210090.jpg,,,,,['whiskey'],['liqueurs']
335,Alcoholic,Royal Flush,Old-fashioned glass,"Cranberry Juice, Chambord Raspberry Liqueur, Peach Schnapps, Crown Royal, ","Cranberry juice - 1 oz , Chambord raspberry liqueur - 1/2 oz , Peach schnapps - 1 oz , Crown Royal - 1 1/2 oz ,",Pour all the ingredients into tumbler over ice. Strain into glass.,https://www.acouplecooks.com/wp-content/uploads/2021/08/Royal-Flush-Drink-001.jpg,,,,,['whiskey'],['liqueurs']
336,Alcoholic,Rum Cobbler,Old-fashioned glass,"Orange, Maraschino Cherry, Dark Rum, Lemon, Club Soda, Sugar, ","Orange - 1 , Maraschino cherry - 1 , Dark rum - 2 oz , Lemon - 1 , Club soda - 3 oz , Sugar - 1 tsp superfine ,","In an old-fashioned glass, dissolve the sugar in the club soda. Add crushed ice until the glass is almost full. Add the rum. Stir well. Garnish with the cherry and the orange and lemon slices.",http://www.thecocktaildb.com/images/media/drink/5vh9ld1504390683.jpg,,,,,['rum'],['liqueurs']
337,Alcoholic,Ruby Tuesday,Highball glass,"Grenadine, Cranberry Juice, Gin, ","Grenadine - 2 splashes , Cranberry juice - 5 oz , Gin - 2 oz ,",Pour gin and cranberry into a highball filled with ice cubes. Add grenadine and stir.,http://www.thecocktaildb.com/images/media/drink/qsyqqq1441553437.jpg,,,,,['gin'],
338,Non alcoholic,Rail Splitter,Highball glass,"Ginger Ale, Lemon Juice, Sugar Syrup, ","Ginger ale, Lemon juice, Sugar syrup - 2 tsp ,",Mix sugar syrup with lemon juice in a tall glass. Fill up with ginger ale.,http://www.thecocktaildb.com/images/media/drink/stsuqq1441207660.jpg,,,,,"['beer', 'gin']",
339,Alcoholic,Rosemary Blue,Balloon Glass,"Rosemary, Tonic Water, Blue Curacao, Gin, ","Rosemary - Garnish with, Tonic Water - 100 ml, Blue Curacao - 15 ml, Gin - 50 ml,","1) Add the Bombay Sapphire, Blue Curacao, rosemary sprig and gently squeezed lemon wedge to a balloon glass. Swirl well to combine.

2) Fill with cubed ice and top with the Fever-Tree Light Tonic Water.

3) Gently fold with a bar spoon to mix.",https://www.thecocktaildb.com/images/media/drink/qwc5f91512406543.jpg,,,,,"['gin', 'wine']",
340,Alcoholic,Ramos Gin Fizz,Highball glass,"Soda Water, Vanilla Extract, Egg White, Cream, Sugar Syrup, Lemon Juice, Gin, ","Soda Water - 2 cl, Vanilla extract - 2 drop, Egg White - 1, Cream - 6 cl, Sugar Syrup - 3 cl, Lemon Juice - 3 cl, Gin - 4.5 cL,","Prepare all the ingredients on the counter to be able to work well and quickly, especially the cream and egg white.



Pour all the ingredients into a shaker.



Shake vigorously for 1 minute: cream and egg white must be mixed perfectly, so don't rush.



Now open the shaker and put some ice and shake for 1-2 minutes. It depends on how long you can resist!



Pour into a highball glass, add a splash of soda and garnish to taste.



Ramos Gin Fizz was once drunk as an invigorating drink or even as a breakfast, try it as an aperitif and after dinner and you will discover a little gem now lost.",https://www.thecocktaildb.com/images/media/drink/967t911643844053.jpg,,,,,['gin'],
341,Alcoholic,Royal Gin Fizz,Highball glass,"Carbonated Water, Egg, Powdered Sugar, Lemon, Gin, ","Carbonated water, Egg - 1 whole , Powdered sugar - 1 tsp , Lemon - Juice of 1/2 , Gin - 2 oz ,","Shake all ingredients (except carbonated water) with ice and strain into a highball glass over two ice cubes. Fill with carbonated water, stir, and serve.",https://tailgatermagazine.com/wp-content/uploads/2016/07/RoyalGinFizz3.jpg,,,,,['gin'],
342,Alcoholic,Rum Milk Punch,Collins glass,"Nutmeg, Powdered Sugar, Milk, Light Rum, ","Nutmeg, Powdered sugar - 1 tsp , Milk - 1 cup , Light rum - 2 oz ,",Shake all ingredients (except nutmeg) with ice and strain into a collins glass. Sprinkle nutmeg on top and serve.,http://www.thecocktaildb.com/images/media/drink/w64lqm1504888810.jpg,,,,,['rum'],
343,Alcoholic,Raspberry Julep,Cordial glass,"Mint, Raspberry Syrup, Bourbon, ","Mint - 8, Raspberry syrup - 1/2 oz, Bourbon - 2 oz,","Softly muddle the mint leaves and raspberry syrup in the bottom of the cup. Add crushed ice and Bourbon to the cup and then stir. Top with more ice, garnish with a mint sprig.",https://www.thecocktaildb.com/images/media/drink/hyztmx1598719265.jpg,,,,,['whiskey'],
344,Alcoholic,Rum Screwdriver,Highball glass,"Orange Juice, Light Rum, ","Orange juice - 5 oz , Light rum - 1 1/2 oz ,","Pour rum into a highball glass over ice cubes. Add orange juice, stir, and serve.","https://ik.imagekit.io/bhug69xts/tr:h-1200,w-1200/ginger-screwdriver.png",,,,,['rum'],
345,Alcoholic,Raspberry Cooler,Highball glass,"Ice, Lemon-Lime Soda, Raspberry Vodka, ","Ice, Lemon-lime soda - 4 oz , Raspberry vodka - 2 oz ,",Pour the raspberry vodka and soda into a highball glass almost filled with ice cubes. Stir well.,http://www.thecocktaildb.com/images/media/drink/suqyyx1441254346.jpg,,,,,['vodka'],
346,Alcoholic,Rum Old-fashioned,Old-fashioned glass,"Lime Peel, Water, Bitters, Powdered Sugar, 151 Proof Rum, Light Rum,","Lime peel - Twist of , Water - 1 tsp , Bitters - 1 dash , Powdered sugar - 1/2 tsp , 151 proof rum - 1 tsp , Light rum - 1 1/2 oz ,","Stir powdered sugar, water, and bitters in an old-fashioned glass. When sugar has dissolved add ice cubes and light rum. Add the twist of lime peel, float 151 proof rum on top, and serve.","https://images.immediate.co.uk/production/volatile/sites/30/2021/10/Rum-old-fashioned-00d18bc.jpg?quality=90&webp=true&resize=600,545",,,,,['rum'],
347,Alcoholic,Russian Spring Punch,Highball glass,"Lemon Juice, Sugar Syrup, Creme De Cassis, Vodka, ","Lemon Juice - 2.5 cl, Sugar Syrup - 1 cl, Creme de Cassis - 1.5 cl, Vodka - 2.5 cl,","Pour the ingredients into an highball glass, top with Sparkling wine.",http://www.thecocktaildb.com/images/media/drink/ctt20s1504373488.jpg,,,,,['vodka'],['liqueurs']
348,Alcoholic,Radioactive Long Island Iced Tea,Collins Glass,"Malibu Rum, Midori Melon Liqueur, Chambord Raspberry Liqueur, Triple Sec, Gin, Tequila, Vodka, Rum, ","Malibu rum - 1 oz , Midori melon liqueur - 1 oz , Chambord raspberry liqueur - 1 oz , Triple sec - 1 oz , Gin - 1 oz , Tequila - 1 oz , Vodka - 1 oz , Rum - 1 oz ,",Pour all ingredients over ice in a very tall glass. Sip cautiously.,http://www.thecocktaildb.com/images/media/drink/rdvqmh1503563512.jpg,,,,,"['gin', 'rum', 'tequila', 'vodka']",['liqueurs']
349,Alcoholic,Smut,Beer mug,"Orange Juice, Pepsi Cola, Peach Schnapps, Red Wine, ","Orange juice - 1/3 part , Pepsi Cola - 1/3 part , Peach schnapps - 1 shot , Red wine - 1/3 part ,",Throw it all together and serve real cold.,https://cdn.veeg.co/app/uploads/2021/03/11013658/Wine__Orange_Juice_Cocktail_web_04.jpg,,,,,['wine'],
350,Alcoholic,Spritz,Old-Fashioned glass,"Soda Water, Campari, Prosecco, ","Soda Water - splash, Campari - 4 cl, Prosecco - 6 cl,","Build into glass over ice, garnish and serve.",http://www.thecocktaildb.com/images/media/drink/j9evx11504373665.jpg,,,,,['wine'],
351,Alcoholic,Scooter,Cocktail glass,"Light Cream, Amaretto, Brandy, ","Light cream - 1 oz , Amaretto - 1 oz , Brandy - 1 oz ,","Shake all ingredients well with cracked ice, strain into a cocktail glass, and serve.",http://www.thecocktaildb.com/images/media/drink/twuptu1483388307.jpg,,,,,['brandy'],['liqueurs']
352,Alcoholic,Sangria,Pitcher,"Cinnamon, Cloves, Lemon Juice, Orange Juice, Sugar, Red Wine, ","Cinnamon, Cloves, Lemon juice - 1 cup , Orange juice - 1 cup , Sugar - 1/2 cup , Red wine - 1 bottle ,",Mix all together in a pitcher and refrigerate. Add cloves and cinnamon sticks to taste. Serve in wine glasses.,https://www.thecocktaildb.com/images/media/drink/xrvxpp1441249280.jpg,,,,,['wine'],
353,Alcoholic,Stinger,Cocktail glass,"White Creme De Menthe, Brandy, ","White Creme de Menthe - 1/2 oz , Brandy - 1 1/2 oz ,","Pour in a mixing glass with ice, stir and strain into a cocktail glass. May also be served on rocks in a rocks glass.",http://www.thecocktaildb.com/images/media/drink/2ahv791504352433.jpg,,,,,['brandy'],
354,Alcoholic,Sazerac,Old-fashioned glass,"Lemon Peel, Bourbon, Water, Peychaud Bitters, Sugar, Ricard, ","Lemon peel - 1 twist of , Bourbon - 2 oz , Water - 1 tsp , Peychaud bitters - 2 dashes , Sugar - 1/2 tsp superfine , Ricard - 1 tsp ,","Rinse a chilled old-fashioned glass with the absinthe, add crushed ice, and set it aside. Stir the remaining ingredients over ice and set it aside. Discard the ice and any excess absinthe from the prepared glass, and strain the drink into the glass. Add the lemon peel for garnish.",http://www.thecocktaildb.com/images/media/drink/vvpxwy1439907208.jpg,,,,,['whiskey'],
355,Alcoholic,Sidecar,Cocktail glass,"Lemon Juice, Cointreau, Cognac, ","Lemon juice - 1 oz , Cointreau - 1/2 oz , Cognac - 2 oz ,",Pour all ingredients into cocktail shaker filled with ice. Shake well and strain into cocktail glass.,http://www.thecocktaildb.com/images/media/drink/stwxuq1439906852.jpg,,,,,['brandy'],['liqueurs']
356,Alcoholic,Snowday,Collins glass,"Orange Peel, Angostura Bitters, Blood Orange, Ruby Port, Amaro Montenegro, Vodka, ","Orange Peel - Garnish with, Angostura Bitters - Dash, Blood Orange - 1 tsp, Ruby Port - 1 oz, Amaro Montenegro - 1 oz, Vodka - 1 oz,",Stir all ingredients with ice. Strain into a chilled rocks glass over fresh ice. Express orange peel over drink and garnish.,https://www.thecocktaildb.com/images/media/drink/4n1ipk1614009624.jpg,,,,,"['vodka', 'wine']",
357,Alcoholic,Spice 75,Wine Glass,"Orange Spiral, Champagne, Lime Juice, Rum, Allspice, Sugar, ","Orange spiral - Garnish with, Champagne - 6 cl, Lime Juice - 90 ml, Rum - 20 cl, Allspice - 1 tblsp, Sugar - 60 ml,","Gently warm 60g golden caster sugar in a pan with 30ml water and 1 tbsp allspice. Cook gently until the sugar has dissolved, then leave the mixture to cool. Strain through a sieve lined with a coffee filter (or a double layer of kitchen paper).



Pour 60ml of the spiced syrup into a cocktail shaker along with 200ml rum and 90ml lime juice. Shake with ice and strain between six flute glasses. Top up with 600ml champagne and garnish each with an orange twist.",https://www.thecocktaildb.com/images/media/drink/0108c41576797064.jpg,,,,,"['rum', 'wine']",
358,Alcoholic,Snowball,Highball glass,"Ice, Lemon, Lemonade, Advocaat, ","Ice - cubes, Lemon - 1 slice , Lemonade - 8-10 oz cold , Advocaat - 1 1/2 oz ,",Place one ice cube in the glass and add 1 1/2 oz of Advocaat. Fill up the glass with lemonade and decorate with a slice of lemon. Serve at once.,https://www.sainsburysmagazine.co.uk/media/11293/download/Snowball-cocktail.jpg?v=1,,,,,,
359,Alcoholic,Shot-gun,Shot glass,"Wild Turkey, Jack Daniels, Jim Beam, ","Wild Turkey - 1 oz , Jack Daniels - 1 part , Jim Beam - 1 part ,",Pour one part Jack Daneils and one part Jim Beam into shot glass then float Wild Turkey on top.,http://www.thecocktaildb.com/images/media/drink/2j1m881503563583.jpg,,,,,['whiskey'],['liqueurs']
360,Alcoholic,Salty Dog,Highball glass,"Salt, Gin, Grapefruit Juice, ","Salt - 1/4 tsp , Gin - 1 1/2 oz , Grapefruit juice - 5 oz ,","Pour all ingredients over ice cubes in a highball glass. Stir well and serve. (Vodka may be substituted for gin, if preferred.)",http://www.thecocktaildb.com/images/media/drink/4vfge01504890216.jpg,,,,,['gin'],
361,Alcoholic,Stone Sour,Whiskey sour glass,"Sweet And Sour, Orange Juice, Apricot Brandy, ","Sweet and sour - 1 oz , Orange juice - 1 oz , Apricot brandy - 1 oz ,","Shake all ingredients with ice, strain into a chilled whiskey sour glass, and serve.",http://www.thecocktaildb.com/images/media/drink/vruvtp1472719895.jpg,,,,,"['beer', 'brandy']",
362,Alcoholic,Sea breeze,Highball glass,"Grapefruit Juice, Cranberry Juice, Vodka, ","Grapefruit juice - 1 oz , Cranberry juice - 4 oz , Vodka - 1 1/2 oz ,",Build all ingredients in a highball glass filled with ice. Garnish with lime wedge.,http://www.thecocktaildb.com/images/media/drink/7rfuks1504371562.jpg,,,,,['vodka'],
363,Alcoholic,Scotch Sour,Whiskey sour glass,"Cherry, Lemon, Powdered Sugar, Lime, Scotch, ","Cherry - 1 , Lemon - 1/2 slice , Powdered sugar - 1/2 tsp , Lime - Juice of 1/2 , Scotch - 1 1/2 oz ,","Shake scotch, juice of lime, and powdered sugar with ice and strain into a whiskey sour glass. Decorate with 1/2 slice lemon, top with the cherry, and serve.",http://www.thecocktaildb.com/images/media/drink/0dnb6k1504890436.jpg,,,,,['whiskey'],
364,Alcoholic,Sweet Tooth,Highball Glass,"Milk, Godiva Liqueur, ","Milk, Godiva liqueur - 2 shots ,","Put 2 shots Godiva Liquour into a glass, add as much or as little milk as you would like.",https://www.saq.com/media/catalog/product/g/o/gourmandise-ec-1_1610403940.png?quality=80&fit=bounds&height=&width=,,,,,,
365,Alcoholic,Screwdriver,Highball glass,"Orange Juice, Vodka, ","Orange juice, Vodka - 2 oz ,",Mix in a highball glass with ice. Garnish and serve.,http://www.thecocktaildb.com/images/media/drink/8xnyke1504352207.jpg,,,,,['vodka'],
