,alcoholic,cocktail_name,glass,ingredients,ingredients_and_quantities,instructions,cocktail_picture,popular_month_name,visitors,popular_month_no,popular_season_name,alcohol_type_includes,liqueurs_includes
242,Alcoholic,Lone Tree Cocktail,Cocktail glass,"Gin, Sweet Vermouth, ","Gin - 1 1/2 oz , Sweet Vermouth - 3/4 oz ,","Stir ingredients with ice, strain into a cocktail glass, and serve.",http://www.thecocktaildb.com/images/media/drink/tsxpty1468923417.jpg,,,,,"['gin', 'wine']",['liqueurs']
243,Alcoholic,Lazy Coconut Paloma,Highball glass,"Soda Water, Grapefruit Juice, Coconut Liqueur, ","Soda Water - Top, Grapefruit Juice - 75 ml, Coconut Liqueur - 30 ml,",Mix the coconut liqueur (preferably tequila) with the grapefruit juice and top with soda water. Garnish with a large grapefruit slice against the inside of the glass.,https://www.thecocktaildb.com/images/media/drink/rytuex1598719770.jpg,,,,,,
244,Alcoholic,Long Island Iced Tea,Highball glass,"Lemon Peel, Coca-Cola, Gin, Light Rum, Tequila, Vodka, ","Lemon peel - Twist of , Coca-Cola - 1 dash , Gin - 1/2 oz , Light rum - 1/2 oz , Tequila - 1/2 oz , Vodka - 1/2 oz ,",Mix all contents in a highball glass and sitr gently. Add dash of Coca-Cola for the coloring and garnish with lemon or lime twist.,http://www.thecocktaildb.com/images/media/drink/wx7hsg1504370510.jpg,,,,,"['gin', 'rum', 'tequila', 'vodka']",
245,Alcoholic,Lemon Elderflower Spritzer,Highball glass,"Fresh Lemon Juice, Soda Water, Vodka, Elderflower Cordial, ","Fresh Lemon Juice - Top, Soda Water - 1/3 cup, Vodka - 1 shot, Elderflower cordial - 2 tsp,","Pour all ingredients over ice, stir and enjoy!

",https://www.thecocktaildb.com/images/media/drink/125w0o1630407389.jpg,,,,,['vodka'],
246,Non alcoholic,Lassi - A South Indian Drink,Highball Glass,"Mint, Salt, Cumin Seed, Water, Yoghurt, ","Mint - 1/4 tsp dried , Salt - 1/4 tsp , Cumin seed - 1/2 tsp ground roasted , Water - 1 1/4 cup cold , Yoghurt - 1/2 cup plain ,","Blend in a blender for 3 seconds. Lassi is one of the easiest things to make, and there are many ways of making it. Basically, it is buttermilk (yoghurt whisked with water), and you can choose almost any consistency that you like, from the thinnest to the thickest. Serve cold.",http://www.thecocktaildb.com/images/media/drink/iq6scx1487603980.jpg,,,,,,
247,Non alcoholic,Melya,Coffee mug,"Cocoa Powder, Honey, Espresso, ","Cocoa powder, Honey - Unsweetened , Espresso, ","Brew espresso. In a coffee mug, place 1 teaspoon of unsweetened powdered cocoa, then cover a teaspoon with honey and drizzle it into the cup. Stir while the coffee brews, this is the fun part. The cocoa seems to coat the honey without mixing, so you get a dusty, sticky mass that looks as though it will never mix. Then all at once, presto! It looks like dark chocolate sauce. Pour hot espresso over the honey, stirring to dissolve. Serve with cream.",https://nomoneynotime.com.au/imager/uploads/recipes/11344/pexels-lisa-228183_461122a663362b265b24d0ffaf0f7f5f.webp,,,,,,
248,Alcoholic,Mojito,Highball glass,"Soda Water, Mint, Sugar, Lime, Light Rum, ","Soda water, Mint - 2-4 , Sugar - 2 tsp , Lime - Juice of 1 , Light rum - 2-3 oz ,",Muddle mint leaves with sugar and lime juice. Add a splash of soda water and fill the glass with cracked ice. Pour the rum and top with soda water. Garnish and serve with straw.,http://www.thecocktaildb.com/images/media/drink/rxtqps1478251029.jpg,September,185.0,9.0,Autumn,['rum'],
249,Alcoholic,Mimosa,Champagne flute,"Orange Juice, Champagne, ","Orange juice - 2 oz , Champagne - Chilled ,","Ensure both ingredients are well chilled, then mix into the glass. Serve cold.",http://www.thecocktaildb.com/images/media/drink/juhcuu1504370685.jpg,,,,,['wine'],
250,Alcoholic,Mai Tai,Collins glass,"Cherry, Sweet And Sour, Triple Sec, Orgeat Syrup, Light Rum, ","Cherry - 1 , Sweet and sour - 1 1/2 oz , Triple sec - 1/2 oz , Orgeat syrup - 1/2 oz , Light rum - 1 oz ,",Shake all ingredients with ice. Strain into glass. Garnish and serve with straw.,http://www.thecocktaildb.com/images/media/drink/twyrrp1439907470.jpg,September,4340.0,9.0,Autumn,"['beer', 'rum']",['liqueurs']
251,Alcoholic,Martini,Cocktail glass,"Olive, Dry Vermouth, Gin, ","Olive - 1 , Dry Vermouth - 1/3 oz , Gin - 1 2/3 oz ,","Straight: Pour all ingredients into mixing glass with ice cubes. Stir well. Strain in chilled martini cocktail glass. Squeeze oil from lemon peel onto the drink, or garnish with olive.",http://www.thecocktaildb.com/images/media/drink/71t8581504353095.jpg,,,,,"['gin', 'wine']",['liqueurs']
252,Alcoholic,Michelada,Pint glass,"Soy Sauce, Worcestershire Sauce, Hot Sauce, Lime Juice, Tomato Juice, Beer, ","Soy Sauce - Dash, Worcestershire Sauce - Dash, Hot Sauce - Dash, Lime Juice - 1 tblsp, Tomato Juice - 4 oz, Beer - 4 oz,","Mix the beer with tomato juice, freshly squeezed lime juice, and Worcestershire sauce, teriyaki sauce, soy sauce, or hot sauce.

Served In a chilled, salt-rimmed glass

",https://www.thecocktaildb.com/images/media/drink/u736bd1605907086.jpg,,,,,['beer'],
253,Alcoholic,Manhattan,Cocktail glass,"Orange Peel, Maraschino Cherry, Ice, Angostura Bitters, Bourbon, Sweet Vermouth, ","Orange peel - 1 twist of , Maraschino cherry - 1 , Ice - 2 or 3 , Angostura bitters - dash , Bourbon - 2 1/2 oz Blended , Sweet Vermouth - 3/4 oz ,","Stirred over ice, strained into a chilled glass, garnished, and served up.",http://www.thecocktaildb.com/images/media/drink/ec2jtz1504350429.jpg,,,,,"['whiskey', 'wine']",['liqueurs']
254,Alcoholic,Margarita,Cocktail glass,"Salt, Lime Juice, Triple Sec, Tequila, ","Salt, Lime juice - 1 oz , Triple sec - 1/2 oz , Tequila - 1 1/2 oz ,","Rub the rim of the glass with the lime slice to make the salt stick to it. Take care to moisten only the outer rim and sprinkle the salt on it. The salt should present to the lips of the imbiber and never mix into the cocktail. Shake the other ingredients with ice, then carefully pour into the glass.",http://www.thecocktaildb.com/images/media/drink/wpxpvu1439905379.jpg,,,,,['tequila'],['liqueurs']
255,Alcoholic,Mauresque,Collins glass,"Water, Orgeat Syrup, Ricard, ","- ,  - ,  - ,  - , Water - Full Glass, Orgeat Syrup - 1 cl, Ricard - 3 cl,","1 - Pour the Ricard (or pastis)

2 - Pour the orgeat syrup

3 - Finally pour the water and add ice cubes at your convenience.



Add the ice cubes at the end, otherwise the syrup and pastis do not mix well.",https://www.thecocktaildb.com/images/media/drink/duwfa11686236556.jpg,,,,,,
256,Alcoholic,Mint Julep,Collins glass,"Water, Powdered Sugar, Bourbon, Mint, ","Water - 2 tsp , Powdered sugar - 1 tsp , Bourbon - 2 1/2 oz , Mint - 4 fresh ,","In a highball glass gently muddle the mint, sugar and water. Fill the glass with cracked ice, add Bourbon and stir well until the glass is well frosted. Garnish with a mint sprig.",https://www.thecocktaildb.com/images/media/drink/squyyq1439907312.jpg,,,,,['whiskey'],
257,Alcoholic,Mudslinger,Punch bowl,"Pepsi Cola, Orange Juice, Southern Comfort, ","Pepsi Cola - 750 ml , Orange juice - 1 L , Southern Comfort - 750 ml ,",Add all contents to a large jug or punch bowl. Stir well!,http://www.thecocktaildb.com/images/media/drink/hepk6h1504885554.jpg,,,,,,['liqueurs']
258,Alcoholic,Martinez 2,Cocktail glass,"Angostura Bitters, Maraschino Liqueur, Sweet Vermouth, Gin, ","Angostura Bitters - 2 dashes, Maraschino Liqueur - 1 tsp, Sweet Vermouth - 1 1/2 oz, Gin - 1 1/2 oz,","Add all ingredients to a mixing glass and fill with ice.



Stir until chilled, and strain into a chilled coupe glass.",https://www.thecocktaildb.com/images/media/drink/fs6kiq1513708455.jpg,,,,,"['gin', 'wine']",['liqueurs']
259,Alcoholic,Moranguito,Shot glass,"Grenadine, Tequila, Absinthe, ","Grenadine - 1/5 , Tequila - 2/5 , Absinthe - 2/5 ,","first you put rhe absinthe, then put tequila, then put the Granadine syrup.",http://www.thecocktaildb.com/images/media/drink/urpsyq1475667335.jpg,,,,,['tequila'],['liqueurs']
260,Alcoholic,Miami Vice,Cocktail glass,"Daiquiri Mix, Pina Colada Mix, 151 Proof Rum,","Daiquiri mix - frozen , Pina colada mix - frozen , 151 proof rum - 5 oz Bacardi ,","First: Mix pina colada with 2.5 oz. of rum with ice(set aside). Second: Mix daiquiri with 2.5 oz. of rum with ice. Third: While frozen, add pina colda mix then daiquiri mix in glass (Making sure they do not get mixed together).",https://assets-prd.punchdrink.com/wp-content/uploads/2021/03/03102541/Article2-Miami-Vice-Cocktail-Recipe.jpg,,,,,['rum'],
261,Alcoholic,Moscow Mule,Copper Mug,"Ginger Ale, Lime Juice, Vodka, ","Ginger ale - 8 oz , Lime juice - 2 oz , Vodka - 2 oz ,",Combine vodka and ginger beer in a highball glass filled with ice. Add lime juice. Stir gently. Garnish.,http://www.thecocktaildb.com/images/media/drink/3pylqc1504370988.jpg,,,,,"['beer', 'gin', 'vodka']",
262,Alcoholic,Mulled Wine,Collins Glass,"Brandy, Red Wine, Lemon Peel, Cinnamon, Cloves, Sugar, Water, ","Brandy - 1/4 cup , Red wine - 750 ml , Lemon peel - 1 , Cinnamon - 2 , Cloves - 12 , Sugar - 1 cup , Water - 3 cups ,","Simmer 3 cups water with, sugar, cloves, cinnamon sticks, and lemon peel in a stainless steel pot for 10 minutes. Add wine heat to a ""coffee temperature"" (DO NOT BOIL) then add the brandy.",http://www.thecocktaildb.com/images/media/drink/iuwi6h1504735724.jpg,,,,,"['brandy', 'wine']",
263,Non alcoholic,Masala Chai,Coffee Mug,"Milk, Sugar, Black Pepper, Cinnamon, Cloves, Cardamom, Ginger, Tea, Water, ","Milk - to taste, Sugar -  to taste
, Black pepper - 1-2 whole , Cinnamon - 1 piece , Cloves - 3 , Cardamom - 3-4 crushed , Ginger - 1 chunk dried , Tea - 3-4 tsp , Water - 2 cups ,",Bring 2 cups of water to boil. Add all the ingredients and boil again for about 15 seconds. Let stand for a minute. Warm milk in a pot. Filter tea into cups. Add milk and sugar. That's IT.,http://www.thecocktaildb.com/images/media/drink/uyrpww1441246384.jpg,,,,,['gin'],
264,Alcoholic,Munich Mule,Highball glass,"Lemon, Cucumber, Ginger Beer, Lime Juice, Gin, ","lemon - Chopped, Cucumber - Chopped, Ginger Beer - 10 cl, Lime Juice - 2 cl, Gin - 5 cl,","Fill glass with ice

Pour Gin and Lime Juice

Fill glass with Ginger Beer

Garnish with Cucumer and Lime slice",https://www.gourmet-magazin.de/fileadmin/user_upload/rezepte/drinks/cocktails/munich-mule-3.jpg,,,,,"['beer', 'gin']",
265,Alcoholic,Mocha-Berry,Irish coffee cup,"Whipped Cream, Cocoa Powder, Chambord Raspberry Liqueur, Coffee, ","Whipped cream, Cocoa powder - 2 tblsp , Chambord raspberry liqueur - 2 oz , Coffee - 6 oz ,","pour 6 oz. of coffee in a mug or Irish coffee cup. add coca mix and chambord, mix well and top off with whipped cream.",http://www.thecocktaildb.com/images/media/drink/vtwyyx1441246448.jpg,,,,,,['liqueurs']
266,Alcoholic,Mango Mojito,Jar,"Mango, Soda Water, Ice, White Rum, Mint, Mango, Lime, ","Mango - Garnish with, Soda Water - Top, Ice - cubes, White Rum - 200 ml, Mint - Sprig, Mango - 1 Fresh, Lime - 3,","Squeeze the juice from 1½ limes and blend with the mango to give a smooth purée.

Cut the rest of the limes into quarters, and then cut each wedge in half again. Put 2 pieces of lime in a highball glass for each person and add 1 teaspoon of caster sugar and 5-6 mint leaves to each glass. Squish everything together with a muddler or the end of a rolling pin to release all the flavours from the lime and mint.

Divide the mango purée between the glasses and add 30ml white rum and a handful of crushed ice to each one, stirring well to mix everything together. Top up with soda water to serve and garnish with extra mint, if you like.",https://www.thecocktaildb.com/images/media/drink/wfqmgm1630406820.jpg,,,,,['rum'],
267,Alcoholic,Mojito Extra,Collins glass,"Angostura Bitters, Club Soda, Dark Rum, Lemon Juice, Mint, ","Angostura bitters - 8 drops , Club soda - 1/8 L , Dark rum - 1/8 L Jamaican , Lemon juice - 3 cl , Mint - 1/2 handful ,","Put mint with lemon juice in a glas, mash the mint with a spoon, ice, rum & fill up with club soda. Top it with Angostura.",https://www.thecocktaildb.com/images/media/drink/vwxrsw1478251483.jpg,,,,,['rum'],
268,Alcoholic,Monkey Gland,Cocktail glass,"Grenadine, Orange Juice, Benedictine, Gin, ","Grenadine - 1 tsp , Orange juice - 1/2 oz , Benedictine - 1 tsp , Gin - 2 oz ,","Shake well over ice cubes in a shaker, strain into a chilled cocktail glass.",https://opendrinks.io/img/monkey-gland.723991bb.jpg,,,,,['gin'],['liqueurs']
269,Alcoholic,Midnight Mint,Cocktail glass,"Cream, White Creme De Menthe, Baileys Irish Cream, ","Cream - 3/4 oz double , White Creme de Menthe - 3/4 oz , Baileys irish cream - 1 oz ,","If available, rim cocktail (Martini) glass with sugar syrup then dip into chocolate flakes or powder. Add ingredients into shaker with ice. Shake well then strain into cocktail glass.",http://www.thecocktaildb.com/images/media/drink/svuvrq1441208310.jpg,,,,,,['liqueurs']
270,Alcoholic,Mary Pickford,Cocktail glass,"Maraschino Cherry, Grenadine, Maraschino Liqueur, Pineapple Juice, Light Rum, ","Maraschino cherry - 1 , Grenadine - 1/2 tsp , Maraschino liqueur - 1/2 tsp , Pineapple juice - 1 oz , Light rum - 1 1/2 oz ,",Shake and strain into a chilled large cocktail glass,http://www.thecocktaildb.com/images/media/drink/f9erqb1504350557.jpg,,,,,['rum'],['liqueurs']
271,Alcoholic,Monkey Wrench,Old-fashioned glass,"Bitters, Grapefruit Juice, Light Rum, ","Bitters - 1 dash , Grapefruit juice - 3 oz , Light rum - 1 1/2 oz ,",Pour all of the ingredients into an old-fashioned glass almost filled with ice cubes. Stir well.,http://www.thecocktaildb.com/images/media/drink/8it05n1504353314.jpg,,,,,['rum'],
272,Alcoholic,Negroni,Old-fashioned glass,"Sweet Vermouth, Campari, Gin, ","Sweet Vermouth - 1 oz , Campari - 1 oz , Gin - 1 oz ,","Stir into glass over ice, garnish and serve.",http://www.thecocktaildb.com/images/media/drink/tutwwv1439907127.jpg,,,,,"['gin', 'wine']",['liqueurs']
273,Alcoholic,New York Sour,Whiskey sour glass,"Cherry, Lemon, Red Wine, Sugar, Lemon, Blended Whiskey, ","Cherry, Lemon, Red wine -  (Claret)
, Sugar - 1 tsp , Lemon - Juice of 1/2 , Blended whiskey - 2 oz ,","Shake blended whiskey, juice of lemon, and powdered sugar with ice and strain into a whiskey sour glass. Float claret on top. Decorate with the half-slice of lemon and the cherry and serve.",http://www.thecocktaildb.com/images/media/drink/61wgch1504882795.jpg,,,,,"['whiskey', 'wine']",
274,Alcoholic,Nutty Irishman,Highball Glass,"Milk, Frangelico, Baileys Irish Cream, ","Milk - 1 part , Frangelico - 1 part , Baileys irish cream - 1 part ,",Serve over ice,http://www.thecocktaildb.com/images/media/drink/xspupx1441248014.jpg,,,,,,['liqueurs']
275,Alcoholic,National Aquarium,Collins Glass,"Lemon-Lime Soda, Sour Mix, Blue Curacao, Gin, Vodka, Rum, ","Lemon-lime soda - 1 splash , Sour mix - 2 oz , Blue Curacao - 1/2 oz , Gin - 1/2 oz , Vodka - 1/2 oz , Rum - 1/2 oz ,",Pour all ingredients into a shaker of ice. Shake well. Serve on the rocks.,"https://ik.imagekit.io/bhug69xts/tr:h-1200,w-1200/blue-motorcycle.png",,,,,"['beer', 'gin', 'rum', 'vodka']",
276,Alcoholic,New York Lemonade,Cocktail glass,"Club Soda, Lemon Juice, Grand Marnier, Absolut Citron, ","Club soda - 1 oz , Lemon juice - 2 oz sweetened , Grand Marnier - 1 oz , Absolut Citron - 2 oz ,",Serve in a chilled cocktail glass. Lemon and sugar the rim. Stir and Strain.,http://www.thecocktaildb.com/images/media/drink/b3n0ge1503565473.jpg,,,,,['vodka'],['liqueurs']
277,Non alcoholic,Nuked Hot Chocolate,Coffee mug,"Milk, Vanilla Extract, Sugar, Cocoa Powder, ","Milk - 12 oz , Vanilla extract - 1/2 tsp , Sugar - 1 tsp , Cocoa powder - 2 tsp ,","Mix with a bit of milk (1 oz or so) in coffee mug. Nuke mug for about 30-50 seconds. Stir until the heated cocoa dissolves. Fill mug with milk. Nuke for 1-2 minutes, depending on wattage and preferences as to burnt mouth parts.",http://www.thecocktaildb.com/images/media/drink/xcu6nb1487603142.jpg,,,,,,
278,Alcoholic,Orgasm,Cocktail glass,"Light Cream, Vodka, Triple Sec, Amaretto, Creme De Cacao, ","Light cream - 1 oz , Vodka - 1/2 oz , Triple sec - 1/2 oz , Amaretto - 1/2 oz , Creme de Cacao - 1/2 oz white ,","Shake all ingredients with ice, strain into a chilled cocktail glass, and serve.",https://upload.wikimedia.org/wikipedia/commons/4/4f/Orgasm_%28cocktail%29.jpg,,,,,['vodka'],['liqueurs']
279,Alcoholic,Old Pal,Nick and Nora Glass,"Dry Vermouth, Campari, Rye Whiskey, ","Dry Vermouth - 1 oz, Campari - 1 oz, Rye whiskey - 2 oz,","Chill cocktail glass. Add ingredients to a mixing glass, and fill 2/3 full with ice. Stir about 20 seconds. Empty cocktail glass and strain into the glass. Garnish with a twist of lemon peel.",https://www.acouplecooks.com/wp-content/uploads/2020/04/Old-Pal-Cocktail-005.jpg,,,,,"['whiskey', 'wine']",['liqueurs']
280,Non alcoholic,Orangeade,Highball glass,"Soda Water, Sugar Syrup, Orange Juice, Lemon Juice, ","Soda water, Sugar syrup - 2-3 cl , Orange juice - 15 cl , Lemon juice - 5 cl ,","Place some ice cubes in a large tumbler or highball glass, add lemon juice, orange juice, sugar syrup, and stir well. Top up with cold soda water, serve with a drinking straw.",http://www.thecocktaildb.com/images/media/drink/ytsxxw1441167732.jpg,,,,,,
281,Alcoholic,Orange Whip,Collins Glass,"Ice, Cream, Vodka, Rum, Orange Juice, ","Ice - Over , Cream - 1 package , Vodka - 1 oz , Rum - 1 oz , Orange juice - 4 oz ,",Pour ingredients over ice and stir.,http://www.thecocktaildb.com/images/media/drink/ttyrxr1454514759.jpg,,,,,"['rum', 'vodka']",
282,Alcoholic,Orange Crush,Shot glass,"Orange Juice, Triple Sec, Vodka, ","Orange juice - 1 oz , Triple sec - 1 oz , Vodka - 1 oz ,",Add all ingredients to tumbler-Pour as shot,http://www.thecocktaildb.com/images/media/drink/zvoics1504885926.jpg,,,,,['vodka'],['liqueurs']
283,Alcoholic,Orange Oasis,Highball glass,"Ginger Ale, Orange Juice, Gin, Cherry Brandy, ","Ginger ale, Orange juice - 4 oz , Gin - 1 1/2 oz , Cherry brandy - 1/2 oz ,","Shake brandy, gin, and orange juice with ice and strain into a highball glass over ice cubes. Fill with ginger ale, stir, and serve.","https://ik.imagekit.io/bhug69xts/tr:h-1200,w-1200/orange-oasis.png",,,,,"['beer', 'brandy', 'gin']",
284,Alcoholic,Old Fashioned,Old-fashioned glass,"Water, Sugar, Angostura Bitters, Bourbon, ","Water - dash, Sugar - 1 cube, Angostura bitters - 2 dashes, Bourbon - 4.5 cL,","Place sugar cube in old fashioned glass and saturate with bitters, add a dash of plain water. Muddle until dissolved.

Fill the glass with ice cubes and add whiskey.



Garnish with orange twist, and a cocktail cherry.",http://www.thecocktaildb.com/images/media/drink/vrwquq1478252802.jpg,,,,,['whiskey'],
285,Alcoholic,Oreo Mudslide,Collins Glass,"Oreo Cookie, Vanilla Ice-Cream, Baileys Irish Cream, Kahlua, Vodka, ","Oreo cookie - 1 , Vanilla ice-cream - 2 scoops , Baileys irish cream - 1 oz , Kahlua - 1 oz , Vodka - 1 oz ,","Blend Vodka, Kahlua, Bailey's, ice-cream and the Oreo well in a blender. Pour into a large frosted glass. Garnish with whipped cream and a cherry.",http://www.thecocktaildb.com/images/media/drink/tpwwut1468925017.jpg,,,,,['vodka'],['liqueurs']
286,Alcoholic,Oatmeal Cookie,Mason jar,"Goldschlager, Jagermeister, Butterscotch Schnapps, Baileys Irish Cream, Kahlua, ","Goldschlager - 1/2 part, Jagermeister - 1 part, Butterscotch schnapps - 4 parts, Baileys irish cream - 2 parts, Kahlua - 2 parts,","Just mix it all together.

It's meant to be a shot, but it works just fine as a proper adult-sized drink over lots of ice.



Tastes like an oatmeal cookie.",https://cookingwithcurls.com/wp-content/uploads/2022/03/Oatmeal-Cookie-Cocktail.-cookingwithcurls.com_.jpg,,,,,"['beer', 'whiskey']",['liqueurs']
287,Alcoholic,Orange Push-up,Hurricane glass,"Sour Mix, Orange Juice, Grenadine, Spiced Rum, ","Sour mix - 1 splash , Orange juice - 4 oz , Grenadine - 0.5 oz , Spiced rum - 1.5 oz ,",Combine liquors in a blender. Add a half scoop of ice and blend. Garnish with an orange and cherry flag. So good it will melt in your mouth!!!,http://www.thecocktaildb.com/images/media/drink/mgf0y91503565781.jpg,,,,,"['beer', 'rum']",
288,Alcoholic,Orange Rosemary Collins,Highball glass,"Orange Peel, Rosemary, Soda Water, Rosemary Syrup, Lemon Juice, Orange Juice, Gin, ","Orange Peel - Garnish with, Rosemary - Garnish with, Soda Water - Top, Rosemary Syrup - 25 ml, Lemon Juice - Top, Orange Juice - Top, Gin - 1 shot,",Add the spirits to the bottom of the glass and top equally with the mixer drinks. Garnish with orange slices inside the glass as well as some rosemary on top.,https://www.thecocktaildb.com/images/media/drink/mokcas1604179977.jpg,,,,,"['gin', 'wine']",
289,Non alcoholic,Orange Scented Hot Chocolate,Coffee mug,"Nutmeg, Espresso, Orange Peel, Chocolate, Milk, ","Nutmeg - 1/8 tsp ground , Espresso - 1/2 tsp instant , Orange peel - 3 2-inch strips , Chocolate - 4 oz chopped bittersweet or semi-sweet , Milk - 2 cups ,","Combine all ingredients in heavy medium saucepan. Stir over low heat until chocolate melts. Increase heat and bring just to a boil, stirring often. Remove from heat and whisk untily frothy. Return to heat and bring to boil again. Remove from heat, whisk until frothy. Repeat heating and whisking once again. Discard orange peel. (Can be prepared 2 hours ahead. Let stand at room temperature. Before serving, bring just to boil, remove from heat and whisk until frothy.) Pour hot chocolate into coffee mugs. Makes 2 servings.",http://www.thecocktaildb.com/images/media/drink/hdzwrh1487603131.jpg,,,,,,
290,Alcoholic,Owen's Grandmother's Revenge,Highball glass,"Ice, Lemonade, Beer, Whiskey, ","Ice - 1 cup crushed , Lemonade - 12 oz frozen , Beer - 12 oz , Whiskey - 12 oz ,",Add ingredients and mix in blender.,https://www.thecocktaildb.com/images/media/drink/2x8thr1504816928.jpg,,,,,"['beer', 'whiskey']",
291,Alcoholic,Paloma,Collins glass,"Tequila, Grape Soda, ","Tequila - 1 1/2 oz, Grape Soda - 3 oz,",Stir together and serve over ice.,https://www.thecocktaildb.com/images/media/drink/samm5j1513706393.jpg,,,,,['tequila'],
292,Alcoholic,Paradise,Cocktail glass,"Orange Juice, Apricot Brandy, Gin, ","Orange Juice - 3 parts , Apricot Brandy - 4 parts, Gin - 7 parts,",Shake together over ice. Strain into cocktail glass and serve chilled.,http://www.thecocktaildb.com/images/media/drink/ejozd71504351060.jpg,,,,,"['brandy', 'gin']",
293,Alcoholic,Pink Gin,White wine glass,"Gin, Bitters, ","Gin - 2 oz , Bitters - 3 dashes ,","Pour the bitters into a wine glass. Swirl the glass to coat the inside with the bitters, shake out the excess. Pour the gin into the glass. Do not add ice.",http://www.thecocktaildb.com/images/media/drink/qyr51e1504888618.jpg,,,,,['gin'],
294,Alcoholic,Pegu Club,Cocktail glass,"Orange Bitters, Angostura Bitters, Lime Juice, Orange Curacao, Gin, ","Orange Bitters - 1 dash, Angostura Bitters - 1 dash, Lime Juice - 3/4 oz, Orange Curacao - 3/4 oz, Gin - 1 1/2 oz,","Shake, strain, up, cocktail glass",https://www.thecocktaildb.com/images/media/drink/jfkemm1513703902.jpg,,,,,['gin'],
295,Alcoholic,Pink Lady,Cocktail glass,"Egg White, Light Cream, Grenadine, Gin, ","Egg white - 1 , Light cream - 1 tsp , Grenadine - 1 tsp , Gin - 1 1/2 oz ,","Shake all ingredients with ice, strain into a cocktail glass, and serve.",http://www.thecocktaildb.com/images/media/drink/5ia6j21504887829.jpg,,,,,['gin'],
296,Alcoholic,Pink Moon,Whiskey Glass,"Blackberries, Lime Juice, Elderflower Cordial, Coconut Liqueur, Gin, ","Blackberries - Garnish with, Lime Juice - 30 ml, Elderflower cordial - 25 ml, Coconut Liqueur - 1 shot, Gin - 1 shot,","Slowly shake in a shaker with ice, strain into a square whiskey glass. Top with fresh ice. Add the blackberries to garnish. Add flowers and a green leaf for a special look!",https://www.thecocktaildb.com/images/media/drink/lnjoc81619696191.jpg,,,,,['gin'],
297,Alcoholic,Penicillin,Old-fashioned glass,"Islay Single Malt Scotch, Ginger Syrup, Honey Syrup, Lemon Juice, Blended Scotch, ","Islay single malt Scotch - 1/4 oz, Ginger Syrup - 2 tsp, Honey syrup - 2 tsp, Lemon Juice - 3/4 oz, Blended Scotch - 2 oz,","Shake blended Scotch, lemon juice, honey syrup and ginger syrup with ice. Strain over large ice in chilled rocks glass. Float smoky Scotch on top (be sure to use a smoky Scotch such as an Islay single malt). Garnish with candied ginger.",https://www.thecocktaildb.com/images/media/drink/hc9b1a1521853096.jpg,,,,,"['gin', 'whiskey']",
298,Alcoholic,Pisco Sour,Cocktail glass,"Egg White, Ice, Sugar, Lemon Juice, Pisco, ","Egg White, Ice - 1, Sugar - 1-2 tblsp , Lemon juice - 1 oz , Pisco - 2 oz ,","Vigorously shake and strain contents in a cocktail shaker with ice cubes, then pour into glass and garnish with bitters.

","https://ik.imagekit.io/bhug69xts/tr:h-1200,w-1200/pisco-sour.png",,,,,['brandy'],['liqueurs']
299,Alcoholic,Porto flip,Cocktail glass,"Egg Yolk, Port, Brandy, ","Egg Yolk - 2 parts, Port - 9 parts, Brandy - 3 parts,","Shake ingredients together in a mixer with ice. Strain into glass, garnish and serve.",http://www.thecocktaildb.com/images/media/drink/64x5j41504351518.jpg,,,,,"['brandy', 'wine']",
300,Alcoholic,Pina Colada,Collins glass,"Pineapple, Coconut Milk, Light Rum, ","Pineapple - 3 tblsp , Coconut milk - 3 tblsp , Light rum - 3 oz ,","Mix with crushed ice in blender until smooth. Pour into chilled glass, garnish and serve.",http://www.thecocktaildb.com/images/media/drink/cpf4j51504371346.jpg,,,,,['rum'],
301,Alcoholic,Pink Penocha,Punch bowl,"Cranberry Juice, Orange Juice, Peach Schnapps, Vodka, Everclear, ","Cranberry juice - 1 gal , Orange juice - 1 gal , Peach schnapps - 1750 ml , Vodka - 1750 ml , Everclear - 750 ml ,",mix all ingredients into bowl keep iced stir frequently,https://www.haveacocktail.com/images/da/8/8734.jpg,,,,,['vodka'],
